"namespace","name","table","count","colnames"
"terra-billing-vir","tf-atlas","production_experiment",3494,"production_experiment_id, abhis_znf, all_motif_jsd-production_run_1_encode_fold0, all_motif_jsd_rc-production_run_1_encode_fold0, all_motif_log2_fold_changes-production_run_1_encode_fold0, all_motif_log2_fold_changes_rc-production_run_1_encode_fold0, auprc-production_run_1_encode_fold0, auprc-production_run_1_encode_fold1, auprc-production_run_1_encode_fold2, auprc-production_run_1_encode_fold3, auprc-production_run_1_encode_fold4, auprc_wo_bias-production_run_1_encode_fold0, auprc_wo_bias-production_run_1_encode_fold1, auprc_wo_bias-production_run_1_encode_fold2, auprc_wo_bias-production_run_1_encode_fold3, auprc_wo_bias-production_run_1_encode_fold4, auroc-production_run_1_encode_fold0, auroc-production_run_1_encode_fold1, auroc-production_run_1_encode_fold2, auroc-production_run_1_encode_fold3, auroc-production_run_1_encode_fold4, auroc_wo_bias-production_run_1_encode_fold0, auroc_wo_bias-production_run_1_encode_fold1, auroc_wo_bias-production_run_1_encode_fold2, auroc_wo_bias-production_run_1_encode_fold3, auroc_wo_bias-production_run_1_encode_fold4, best-production_run_1_encode_folds, best_shap_dir-production_run_1_encode_folds, bigWig, bpnet_params_updated_json-production_run_1_encode_fold0, bpnet_params_updated_json-production_run_1_encode_fold1, bpnet_params_updated_json-production_run_1_encode_fold2, bpnet_params_updated_json-production_run_1_encode_fold3, bpnet_params_updated_json-production_run_1_encode_fold4, counts_mean_shap_scores_h5-production_run_1_encode_folds, counts_shap_scores-production_run_1_encode_fold0, counts_shap_scores-production_run_1_encode_fold1, counts_shap_scores-production_run_1_encode_fold2, counts_shap_scores-production_run_1_encode_fold3, counts_shap_scores-production_run_1_encode_fold4, counts_shap_scores_bw-production_run_1_encode_fold0, counts_shap_scores_bw-production_run_1_encode_fold1, counts_shap_scores_bw-production_run_1_encode_fold2, counts_shap_scores_bw-production_run_1_encode_fold3, counts_shap_scores_bw-production_run_1_encode_fold4, counts_shap_scores_relaxed_peaks-production_run_1_encode_fold0, frip_score, gc_distribution_png, gc_neg_only_bed, jsd-production_run_1_encode_fold0, jsd-production_run_1_encode_fold1, jsd-production_run_1_encode_fold2, jsd-production_run_1_encode_fold3, jsd-production_run_1_encode_fold4, jsd_all_peaks-production_run_1_encode_fold0, jsd_all_peaks-production_run_1_encode_fold1, jsd_all_peaks-production_run_1_encode_fold2, jsd_all_peaks-production_run_1_encode_fold3, jsd_all_peaks-production_run_1_encode_fold4, jsd_all_peaks_wo_bias-production_run_1_encode_fold0, jsd_all_peaks_wo_bias-production_run_1_encode_fold1, jsd_all_peaks_wo_bias-production_run_1_encode_fold2, jsd_all_peaks_wo_bias-production_run_1_encode_fold3, jsd_all_peaks_wo_bias-production_run_1_encode_fold4, jsd_wo_bias-production_run_1_encode_fold0, jsd_wo_bias-production_run_1_encode_fold1, jsd_wo_bias-production_run_1_encode_fold2, jsd_wo_bias-production_run_1_encode_fold3, jsd_wo_bias-production_run_1_encode_fold4, known_primary_motif, model-production_run_1_encode_fold0, model-production_run_1_encode_fold1, model-production_run_1_encode_fold2, model-production_run_1_encode_fold3, model-production_run_1_encode_fold4, modisco_counts-production_run_1_encode_bestfold, modisco_counts-production_run_1_encode_meanshap, modisco_counts_h5-production_run_1_encode_bestfold, modisco_counts_h5-production_run_1_encode_meanshap, modisco_profile-production_run_1_encode_bestfold, modisco_profile-production_run_1_encode_meanshap, modisco_profile_h5-production_run_1_encode_bestfold, modisco_profile_h5-production_run_1_encode_meanshap, number_of_peaks, peaks_bed, peaks_inliers_bed, pearson-production_run_1_encode_fold0, pearson-production_run_1_encode_fold1, pearson-production_run_1_encode_fold2, pearson-production_run_1_encode_fold3, pearson-production_run_1_encode_fold4, pearson_all_peaks-production_run_1_encode_fold0, pearson_all_peaks-production_run_1_encode_fold1, pearson_all_peaks-production_run_1_encode_fold2, pearson_all_peaks-production_run_1_encode_fold3, pearson_all_peaks-production_run_1_encode_fold4, pearson_all_peaks_wo_bias-production_run_1_encode_fold0, pearson_all_peaks_wo_bias-production_run_1_encode_fold1, pearson_all_peaks_wo_bias-production_run_1_encode_fold2, pearson_all_peaks_wo_bias-production_run_1_encode_fold3, pearson_all_peaks_wo_bias-production_run_1_encode_fold4, pearson_with_control, pearson_with_control_all_peaks, pearson_wo_bias-production_run_1_encode_fold0, pearson_wo_bias-production_run_1_encode_fold1, pearson_wo_bias-production_run_1_encode_fold2, pearson_wo_bias-production_run_1_encode_fold3, pearson_wo_bias-production_run_1_encode_fold4, performance_reports_all_regions-production_run_1_encode_fold0, performance_reports_all_regions-production_run_1_encode_fold1, performance_reports_all_regions-production_run_1_encode_fold2, performance_reports_all_regions-production_run_1_encode_fold3, performance_reports_all_regions-production_run_1_encode_fold4, performance_reports_peak_only-production_run_1_encode_fold0, performance_reports_peak_only-production_run_1_encode_fold1, performance_reports_peak_only-production_run_1_encode_fold2, performance_reports_peak_only-production_run_1_encode_fold3, performance_reports_peak_only-production_run_1_encode_fold4, predictions_and_metrics_all_peaks_all_chroms-production_run_1_encode_fold0, predictions_and_metrics_all_peaks_all_chroms-production_run_1_encode_fold1, predictions_and_metrics_all_peaks_all_chroms-production_run_1_encode_fold2, predictions_and_metrics_all_peaks_all_chroms-production_run_1_encode_fold3, predictions_and_metrics_all_peaks_all_chroms-production_run_1_encode_fold4, predictions_and_metrics_all_peaks_test_chroms-production_run_1_encode_fold0, predictions_and_metrics_all_peaks_test_chroms-production_run_1_encode_fold1, predictions_and_metrics_all_peaks_test_chroms-production_run_1_encode_fold2, predictions_and_metrics_all_peaks_test_chroms-production_run_1_encode_fold3, predictions_and_metrics_all_peaks_test_chroms-production_run_1_encode_fold4, predictions_and_metrics_chrM_production_run_1_encode_fold0, predictions_and_metrics_test_peaks_all_chroms-production_run_1_encode_fold0, predictions_and_metrics_test_peaks_all_chroms-production_run_1_encode_fold1, predictions_and_metrics_test_peaks_all_chroms-production_run_1_encode_fold2, predictions_and_metrics_test_peaks_all_chroms-production_run_1_encode_fold3, predictions_and_metrics_test_peaks_all_chroms-production_run_1_encode_fold4, predictions_and_metrics_test_peaks_test_chroms-production_run_1_encode_fold0, predictions_and_metrics_test_peaks_test_chroms-production_run_1_encode_fold1, predictions_and_metrics_test_peaks_test_chroms-production_run_1_encode_fold2, predictions_and_metrics_test_peaks_test_chroms-production_run_1_encode_fold3, predictions_and_metrics_test_peaks_test_chroms-production_run_1_encode_fold4, primary_motif_jsd-production_run_1_encode_fold0, primary_motif_jsd_rc-production_run_1_encode_fold0, primary_motif_log2_fold_change-production_run_1_encode_fold0, primary_motif_log2_fold_change_rc-production_run_1_encode_fold0, profile_mean_shap_scores_h5-production_run_1_encode_folds, profile_shap_scores-production_run_1_encode_fold0, profile_shap_scores-production_run_1_encode_fold1, profile_shap_scores-production_run_1_encode_fold2, profile_shap_scores-production_run_1_encode_fold3, profile_shap_scores-production_run_1_encode_fold4, profile_shap_scores_bw-production_run_1_encode_fold0, profile_shap_scores_bw-production_run_1_encode_fold1, profile_shap_scores_bw-production_run_1_encode_fold2, profile_shap_scores_bw-production_run_1_encode_fold3, profile_shap_scores_bw-production_run_1_encode_fold4, profile_shap_scores_relaxed_peaks-production_run_1_encode_fold0, protein_tag, reproducibility, rescue_ratio, sample_summary, self_consistency_ratio, shap_dir_peaks-production_run_1_encode_fold0, shap_dir_peaks-production_run_1_encode_fold1, shap_dir_peaks-production_run_1_encode_fold2, shap_dir_peaks-production_run_1_encode_fold3, shap_dir_peaks-production_run_1_encode_fold4, spearman-production_run_1_encode_fold0, spearman-production_run_1_encode_fold1, spearman-production_run_1_encode_fold2, spearman-production_run_1_encode_fold3, spearman-production_run_1_encode_fold4, spearman_all_peaks-production_run_1_encode_fold0, spearman_all_peaks-production_run_1_encode_fold1, spearman_all_peaks-production_run_1_encode_fold2, spearman_all_peaks-production_run_1_encode_fold3, spearman_all_peaks-production_run_1_encode_fold4, spearman_all_peaks_wo_bias-production_run_1_encode_fold0, spearman_all_peaks_wo_bias-production_run_1_encode_fold1, spearman_all_peaks_wo_bias-production_run_1_encode_fold2, spearman_all_peaks_wo_bias-production_run_1_encode_fold3, spearman_all_peaks_wo_bias-production_run_1_encode_fold4, spearman_with_control, spearman_with_control_all_peaks, spearman_wo_bias-production_run_1_encode_fold0, spearman_wo_bias-production_run_1_encode_fold1, spearman_wo_bias-production_run_1_encode_fold2, spearman_wo_bias-production_run_1_encode_fold3, spearman_wo_bias-production_run_1_encode_fold4, target, target_investigated_as, tissue_name, total_reads"
"terra-billing-vir","tf-atlas","test_rc_experiment_set",31,"test_rc_experiment_set_id, test_rc_experiments"
"terra-billing-vir","tf-atlas","release_experiment_optimize",3459,"release_experiment_optimize_id, auprc-optimize_run_1_peakwise_fold0, auprc-optimize_run_2_peakwise_fold0, auprc-optimize_run_3_peakwise_fold0, auprc-optimize_run_4_peakwise_fold0, auprc-optimize_run_5_peakwise_fold0, auprc-optimize_run_6_peakwise_fold0, auprc-optimize_run_7_peakwise_fold0, auprc_wo_bias-optimize_run_1_peakwise_fold0, auprc_wo_bias-optimize_run_2_peakwise_fold0, auprc_wo_bias-optimize_run_3_peakwise_fold0, auprc_wo_bias-optimize_run_4_peakwise_fold0, auprc_wo_bias-optimize_run_5_peakwise_fold0, auprc_wo_bias-optimize_run_6_peakwise_fold0, auprc_wo_bias-optimize_run_7_peakwise_fold0, auroc-optimize_run_1_peakwise_fold0, auroc-optimize_run_2_peakwise_fold0, auroc-optimize_run_3_peakwise_fold0, auroc-optimize_run_4_peakwise_fold0, auroc-optimize_run_5_peakwise_fold0, auroc-optimize_run_6_peakwise_fold0, auroc-optimize_run_7_peakwise_fold0, auroc_wo_bias-optimize_run_1_peakwise_fold0, auroc_wo_bias-optimize_run_2_peakwise_fold0, auroc_wo_bias-optimize_run_3_peakwise_fold0, auroc_wo_bias-optimize_run_4_peakwise_fold0, auroc_wo_bias-optimize_run_5_peakwise_fold0, auroc_wo_bias-optimize_run_6_peakwise_fold0, auroc_wo_bias-optimize_run_7_peakwise_fold0, bigWig, bpnet_params_updated_json-optimize_run_1_peakwise_fold0, bpnet_params_updated_json-optimize_run_2_peakwise_fold0, bpnet_params_updated_json-optimize_run_3_peakwise_fold0, bpnet_params_updated_json-optimize_run_4_peakwise_fold0, bpnet_params_updated_json-optimize_run_5_peakwise_fold0, bpnet_params_updated_json-optimize_run_6_peakwise_fold0, bpnet_params_updated_json-optimize_run_7_peakwise_fold0, gc_neg_only_bed, jsd-optimize_run_1_peakwise_fold0, jsd-optimize_run_2_peakwise_fold0, jsd-optimize_run_3_peakwise_fold0, jsd-optimize_run_4_peakwise_fold0, jsd-optimize_run_5_peakwise_fold0, jsd-optimize_run_6_peakwise_fold0, jsd-optimize_run_7_peakwise_fold0, jsd_all_peaks-optimize_run_1_peakwise_fold0, jsd_all_peaks-optimize_run_2_peakwise_fold0, jsd_all_peaks-optimize_run_3_peakwise_fold0, jsd_all_peaks-optimize_run_4_peakwise_fold0, jsd_all_peaks-optimize_run_5_peakwise_fold0, jsd_all_peaks-optimize_run_6_peakwise_fold0, jsd_all_peaks-optimize_run_7_peakwise_fold0, jsd_all_peaks_wo_bias-optimize_run_1_peakwise_fold0, jsd_all_peaks_wo_bias-optimize_run_2_peakwise_fold0, jsd_all_peaks_wo_bias-optimize_run_3_peakwise_fold0, jsd_all_peaks_wo_bias-optimize_run_4_peakwise_fold0, jsd_all_peaks_wo_bias-optimize_run_5_peakwise_fold0, jsd_all_peaks_wo_bias-optimize_run_6_peakwise_fold0, jsd_all_peaks_wo_bias-optimize_run_7_peakwise_fold0, jsd_wo_bias-optimize_run_1_peakwise_fold0, jsd_wo_bias-optimize_run_2_peakwise_fold0, jsd_wo_bias-optimize_run_3_peakwise_fold0, jsd_wo_bias-optimize_run_4_peakwise_fold0, jsd_wo_bias-optimize_run_5_peakwise_fold0, jsd_wo_bias-optimize_run_6_peakwise_fold0, jsd_wo_bias-optimize_run_7_peakwise_fold0, median_pearson, median_stdev, model-optimize_run_1_peakwise_fold0, model-optimize_run_2_peakwise_fold0, model-optimize_run_3_peakwise_fold0, model-optimize_run_4_peakwise_fold0, model-optimize_run_5_peakwise_fold0, model-optimize_run_6_peakwise_fold0, model-optimize_run_7_peakwise_fold0, number_of_peaks, optimization_reason, optimize, peak_wise_splits_5fold, peak_wise_splits_supplemental_outputs_5fold, peaks_bed, peaks_inliers_bed, pearson-optimize_run_1_peakwise_fold0, pearson-optimize_run_2_peakwise_fold0, pearson-optimize_run_3_peakwise_fold0, pearson-optimize_run_4_peakwise_fold0, pearson-optimize_run_5_peakwise_fold0, pearson-optimize_run_6_peakwise_fold0, pearson-optimize_run_7_peakwise_fold0, pearson-release_run_1_encode_fold0, pearson-release_run_1_encode_fold1, pearson-release_run_1_encode_fold2, pearson-release_run_1_encode_fold3, pearson-release_run_1_encode_fold4, pearson_all_peaks-optimize_run_1_peakwise_fold0, pearson_all_peaks-optimize_run_2_peakwise_fold0, pearson_all_peaks-optimize_run_3_peakwise_fold0, pearson_all_peaks-optimize_run_4_peakwise_fold0, pearson_all_peaks-optimize_run_5_peakwise_fold0, pearson_all_peaks-optimize_run_6_peakwise_fold0, pearson_all_peaks-optimize_run_7_peakwise_fold0, pearson_all_peaks_wo_bias-optimize_run_1_peakwise_fold0, pearson_all_peaks_wo_bias-optimize_run_2_peakwise_fold0, pearson_all_peaks_wo_bias-optimize_run_3_peakwise_fold0, pearson_all_peaks_wo_bias-optimize_run_4_peakwise_fold0, pearson_all_peaks_wo_bias-optimize_run_5_peakwise_fold0, pearson_all_peaks_wo_bias-optimize_run_6_peakwise_fold0, pearson_all_peaks_wo_bias-optimize_run_7_peakwise_fold0, pearson_wo_bias-optimize_run_1_peakwise_fold0, pearson_wo_bias-optimize_run_2_peakwise_fold0, pearson_wo_bias-optimize_run_3_peakwise_fold0, pearson_wo_bias-optimize_run_4_peakwise_fold0, pearson_wo_bias-optimize_run_5_peakwise_fold0, pearson_wo_bias-optimize_run_6_peakwise_fold0, pearson_wo_bias-optimize_run_7_peakwise_fold0, predictions_and_metrics_all_peaks_all_chroms-optimize_run_1_peakwise_fold0, predictions_and_metrics_all_peaks_all_chroms-optimize_run_2_peakwise_fold0, predictions_and_metrics_all_peaks_all_chroms-optimize_run_3_peakwise_fold0, predictions_and_metrics_all_peaks_all_chroms-optimize_run_4_peakwise_fold0, predictions_and_metrics_all_peaks_all_chroms-optimize_run_5_peakwise_fold0, predictions_and_metrics_all_peaks_all_chroms-optimize_run_6_peakwise_fold0, predictions_and_metrics_all_peaks_all_chroms-optimize_run_7_peakwise_fold0, predictions_and_metrics_all_peaks_test_chroms-optimize_run_1_peakwise_fold0, predictions_and_metrics_all_peaks_test_chroms-optimize_run_2_peakwise_fold0, predictions_and_metrics_all_peaks_test_chroms-optimize_run_3_peakwise_fold0, predictions_and_metrics_all_peaks_test_chroms-optimize_run_4_peakwise_fold0, predictions_and_metrics_all_peaks_test_chroms-optimize_run_5_peakwise_fold0, predictions_and_metrics_all_peaks_test_chroms-optimize_run_6_peakwise_fold0, predictions_and_metrics_all_peaks_test_chroms-optimize_run_7_peakwise_fold0, predictions_and_metrics_test_peaks_all_chroms-optimize_run_1_peakwise_fold0, predictions_and_metrics_test_peaks_all_chroms-optimize_run_2_peakwise_fold0, predictions_and_metrics_test_peaks_all_chroms-optimize_run_3_peakwise_fold0, predictions_and_metrics_test_peaks_all_chroms-optimize_run_4_peakwise_fold0, predictions_and_metrics_test_peaks_all_chroms-optimize_run_5_peakwise_fold0, predictions_and_metrics_test_peaks_all_chroms-optimize_run_6_peakwise_fold0, predictions_and_metrics_test_peaks_all_chroms-optimize_run_7_peakwise_fold0, predictions_and_metrics_test_peaks_test_chroms-optimize_run_1_peakwise_fold0, predictions_and_metrics_test_peaks_test_chroms-optimize_run_2_peakwise_fold0, predictions_and_metrics_test_peaks_test_chroms-optimize_run_3_peakwise_fold0, predictions_and_metrics_test_peaks_test_chroms-optimize_run_4_peakwise_fold0, predictions_and_metrics_test_peaks_test_chroms-optimize_run_5_peakwise_fold0, predictions_and_metrics_test_peaks_test_chroms-optimize_run_6_peakwise_fold0, predictions_and_metrics_test_peaks_test_chroms-optimize_run_7_peakwise_fold0, spearman-optimize_run_1_peakwise_fold0, spearman-optimize_run_2_peakwise_fold0, spearman-optimize_run_3_peakwise_fold0, spearman-optimize_run_4_peakwise_fold0, spearman-optimize_run_5_peakwise_fold0, spearman-optimize_run_6_peakwise_fold0, spearman-optimize_run_7_peakwise_fold0, spearman_all_peaks-optimize_run_1_peakwise_fold0, spearman_all_peaks-optimize_run_2_peakwise_fold0, spearman_all_peaks-optimize_run_3_peakwise_fold0, spearman_all_peaks-optimize_run_4_peakwise_fold0, spearman_all_peaks-optimize_run_5_peakwise_fold0, spearman_all_peaks-optimize_run_6_peakwise_fold0, spearman_all_peaks-optimize_run_7_peakwise_fold0, spearman_all_peaks_wo_bias-optimize_run_1_peakwise_fold0, spearman_all_peaks_wo_bias-optimize_run_2_peakwise_fold0, spearman_all_peaks_wo_bias-optimize_run_3_peakwise_fold0, spearman_all_peaks_wo_bias-optimize_run_4_peakwise_fold0, spearman_all_peaks_wo_bias-optimize_run_5_peakwise_fold0, spearman_all_peaks_wo_bias-optimize_run_6_peakwise_fold0, spearman_all_peaks_wo_bias-optimize_run_7_peakwise_fold0, spearman_wo_bias-optimize_run_1_peakwise_fold0, spearman_wo_bias-optimize_run_2_peakwise_fold0, spearman_wo_bias-optimize_run_3_peakwise_fold0, spearman_wo_bias-optimize_run_4_peakwise_fold0, spearman_wo_bias-optimize_run_5_peakwise_fold0, spearman_wo_bias-optimize_run_6_peakwise_fold0, spearman_wo_bias-optimize_run_7_peakwise_fold0, target, target_investigated_as, tissue_name"
"terra-billing-vir","tf-atlas","analysis_2023_mar_5",28,"analysis_2023_mar_5_id, auprc-production_run_1_encode_fold0, auprc-production_run_1_encode_fold1, auprc-production_run_1_encode_fold2, auprc-production_run_1_encode_fold3, auprc-production_run_1_encode_fold4, auprc_wo_bias-production_run_1_encode_fold0, auprc_wo_bias-production_run_1_encode_fold1, auprc_wo_bias-production_run_1_encode_fold2, auprc_wo_bias-production_run_1_encode_fold3, auprc_wo_bias-production_run_1_encode_fold4, auroc-production_run_1_encode_fold0, auroc-production_run_1_encode_fold1, auroc-production_run_1_encode_fold2, auroc-production_run_1_encode_fold3, auroc-production_run_1_encode_fold4, auroc_wo_bias-production_run_1_encode_fold0, auroc_wo_bias-production_run_1_encode_fold1, auroc_wo_bias-production_run_1_encode_fold2, auroc_wo_bias-production_run_1_encode_fold3, auroc_wo_bias-production_run_1_encode_fold4, best-production_run_1_encode_folds, best_shap_dir-production_run_1_encode_folds, bigWig, counts_shap_scores_bw_CA-TF_REST_peaks_production_run_1_encode_bestfold, counts_shap_scores_bw_dELS_REST_peaks_production_run_1_encode_bestfold, counts_shap_scores_bw_K562_CA-TF_REST_peaks_production_run_1_encode_bestfold, counts_shap_scores_bw_K562_dELS_REST_REST_peaks_production_run_1_encode_bestfold, counts_shap_scores_CA-TF_REST_peaks_production_run_1_encode_bestfold, counts_shap_scores_dELS_REST_peaks_production_run_1_encode_bestfold, counts_shap_scores_K562_CA-TF_REST_peaks_production_run_1_encode_bestfold, counts_shap_scores_K562_dELS_REST_REST_peaks_production_run_1_encode_bestfold, gc_distribution_png, gc_neg_only_bed, jsd-production_run_1_encode_fold0, jsd-production_run_1_encode_fold1, jsd-production_run_1_encode_fold2, jsd-production_run_1_encode_fold3, jsd-production_run_1_encode_fold4, jsd_all_peaks-production_run_1_encode_fold0, jsd_all_peaks-production_run_1_encode_fold1, jsd_all_peaks-production_run_1_encode_fold2, jsd_all_peaks-production_run_1_encode_fold3, jsd_all_peaks-production_run_1_encode_fold4, jsd_all_peaks_wo_bias-production_run_1_encode_fold0, jsd_all_peaks_wo_bias-production_run_1_encode_fold1, jsd_all_peaks_wo_bias-production_run_1_encode_fold2, jsd_all_peaks_wo_bias-production_run_1_encode_fold3, jsd_all_peaks_wo_bias-production_run_1_encode_fold4, jsd_wo_bias-production_run_1_encode_fold0, jsd_wo_bias-production_run_1_encode_fold1, jsd_wo_bias-production_run_1_encode_fold2, jsd_wo_bias-production_run_1_encode_fold3, jsd_wo_bias-production_run_1_encode_fold4, known_primary_motif, model-production_run_1_encode_fold0, model-production_run_1_encode_fold1, model-production_run_1_encode_fold2, model-production_run_1_encode_fold3, model-production_run_1_encode_fold4, model_production_run_1_encode_bestfold, modisco_counts-CA-TF_REST_peaks_production_run_1_encode_bestfold, modisco_counts-dELS_REST_peaks_production_run_1_encode_bestfold, modisco_counts-K562_CA-TF_REST_peaks_production_run_1_encode_bestfold, modisco_counts-K562_dELS_REST_peaks_production_run_1_encode_bestfold, modisco_counts_h5-CA-TF_REST_peaks-production_run_1_encode_bestfold, modisco_counts_h5-dELS_REST_peaks-production_run_1_encode_bestfold, modisco_counts_h5-K562_CA-TF_REST_peaks-production_run_1_encode_bestfold, modisco_counts_h5-K562_dELS_REST_peaks-production_run_1_encode_bestfold, modisco_profile-CA-TF_REST_peaks-production_run_1_encode_bestfold, modisco_profile-dELS_REST_peaks-production_run_1_encode_bestfold, modisco_profile-K562_CA-TF_REST_peaks-production_run_1_encode_bestfold, modisco_profile-K562_dELS_REST_peaks-production_run_1_encode_bestfold, modisco_profile_h5-CA-TF_REST_peaks-production_run_1_encode_bestfold, modisco_profile_h5-dELS_REST_peaks-production_run_1_encode_bestfold, modisco_profile_h5-K562_CA-TF_REST_peaks-production_run_1_encode_bestfold, modisco_profile_h5-K562_dELS_REST_peaks-production_run_1_encode_bestfold, number_of_peaks, peaks_bed, peaks_inliers_bed, pearson-production_run_1_encode_fold0, pearson-production_run_1_encode_fold1, pearson-production_run_1_encode_fold2, pearson-production_run_1_encode_fold3, pearson-production_run_1_encode_fold4, pearson_all_peaks-production_run_1_encode_fold0, pearson_all_peaks-production_run_1_encode_fold1, pearson_all_peaks-production_run_1_encode_fold2, pearson_all_peaks-production_run_1_encode_fold3, pearson_all_peaks-production_run_1_encode_fold4, pearson_all_peaks_wo_bias-production_run_1_encode_fold0, pearson_all_peaks_wo_bias-production_run_1_encode_fold1, pearson_all_peaks_wo_bias-production_run_1_encode_fold2, pearson_all_peaks_wo_bias-production_run_1_encode_fold3, pearson_all_peaks_wo_bias-production_run_1_encode_fold4, pearson_with_control, pearson_with_control_all_peaks, pearson_wo_bias-production_run_1_encode_fold0, pearson_wo_bias-production_run_1_encode_fold1, pearson_wo_bias-production_run_1_encode_fold2, pearson_wo_bias-production_run_1_encode_fold3, pearson_wo_bias-production_run_1_encode_fold4, profile_shap_scores_bw_CA-TF_REST_peaks_production_run_1_encode_bestfold, profile_shap_scores_bw_dELS_REST_peaks_production_run_1_encode_bestfold, profile_shap_scores_bw_K562_CA-TF_REST_peaks_production_run_1_encode_bestfold, profile_shap_scores_bw_K562_dELS_REST_REST_peaks_production_run_1_encode_bestfold, profile_shap_scores_CA-TF_REST_peaks_production_run_1_encode_bestfold, profile_shap_scores_dELS_REST_peaks_production_run_1_encode_bestfold, profile_shap_scores_K562_CA-TF_REST_peaks_production_run_1_encode_bestfold, profile_shap_scores_K562_dELS_REST_REST_peaks_production_run_1_encode_bestfold, protein_tag, sample_summary, shap_dir_CA-TF_REST_peaks_production_run_1_encode_bestfold, shap_dir_dELS_REST_peaks_production_run_1_encode_bestfold, shap_dir_K562_CA-TF_REST_peaks_production_run_1_encode_bestfold, shap_dir_K562_dELS_REST_REST_peaks_production_run_1_encode_bestfold, spearman-production_run_1_encode_fold0, spearman-production_run_1_encode_fold1, spearman-production_run_1_encode_fold2, spearman-production_run_1_encode_fold3, spearman-production_run_1_encode_fold4, spearman_all_peaks-production_run_1_encode_fold0, spearman_all_peaks-production_run_1_encode_fold1, spearman_all_peaks-production_run_1_encode_fold2, spearman_all_peaks-production_run_1_encode_fold3, spearman_all_peaks-production_run_1_encode_fold4, spearman_all_peaks_wo_bias-production_run_1_encode_fold0, spearman_all_peaks_wo_bias-production_run_1_encode_fold1, spearman_all_peaks_wo_bias-production_run_1_encode_fold2, spearman_all_peaks_wo_bias-production_run_1_encode_fold3, spearman_all_peaks_wo_bias-production_run_1_encode_fold4, spearman_with_control, spearman_with_control_all_peaks, spearman_wo_bias-production_run_1_encode_fold0, spearman_wo_bias-production_run_1_encode_fold1, spearman_wo_bias-production_run_1_encode_fold2, spearman_wo_bias-production_run_1_encode_fold3, spearman_wo_bias-production_run_1_encode_fold4, target, tissue_name"
"terra-billing-vir","tf-atlas","sample_johannes_set",4,"sample_johannes_set_id, sample_johanness"
"terra-billing-vir","tf-atlas","znf_release_run_1_set",2,"znf_release_run_1_set_id, znf_release_run_1s"
